24256,Township of St. Clair,Courtright WWTP,Courtright,ON,42.8234,-82.4676,operational,3538,Lambton,806.864,1011.476,1020.4670000000001,1240.0140000000001,1259.461,1591.0610000000001,1329.955,thousand m3
24259,Oneida Nation of the Thames,Oneida Village Wastewater Facility,Southowld,ON,42.8162,-81.4087,operational,3539,Middlesex,,,,,,,,thousand m3
24271,Constance Lake First Nation,Constance Lake First Nation,Constance Lake,ON,49.9101,-84.1303,operational,3556,Cochrane,0.0,0.0,0.0,0.0,0.0,0.0,0.0,thousand m3
24283,Webequie First Nation,Webequie First Nation,Webequie,ON,52.984,-87.3568,operational,3560,Kenora,,,,,,,,thousand m3
24284,Norfolk County Public Works & Environmental Services,Port Dover WWTF,Port Dover,ON,42.7879,-80.1856,operational,3528,Haldimand-Norfolk,1545.373,1487.2350000000001,1240.182,1078.2930000000001,1565.016,1547.557,1566.5529999999999,thousand m3
24285,The Corporation of the County of Prince Edward,Picton Wastewater Treatment Facility,Picton,ON,44.006,-77.1391,operational,3513,Prince Edward,1130.8545,1163.146,878.6721,995.8992000000001,1309.5495,1154.3217,1200.5902,thousand m3
24286,The Corporation of the County of Prince Edward,Wellington Wastewater Treatment Facility,Wellington,ON,43.9474,-77.3637,operational,3513,Prince Edward,267.594,305.772,240.4751,255.02820000000003,346.3011,313.5443,350.4759,thousand m3
24287,Norfolk County Public Works & Environmental Services,Delhi WWTF,Delhi,ON,42.8529,-80.5051,operational,3528,Haldimand-Norfolk,533.476,457.961,342.87800000000004,319.727,383.5495,451.03,490.42,thousand m3
24290,Norfolk County Public Works & Environmental Services,Port Rowan WWTF,Port Rowan,ON,42.6222,-80.4649,operational,3528,Haldimand-Norfolk,204.443,271.847,219.10399999999998,225.144,218.8324,220.488,229.65,thousand m3
24292,Norfolk County Public Works & Environmental Services,Waterford WWTF,Waterford,ON,42.9365,-80.2713,operational,3528,Haldimand-Norfolk,381.79,427.20300000000003,380.50600000000003,367.89300000000003,106.376,431.786,496.51300000000003,thousand m3
24299,Chippewas of Kettle and Stony Point First Nation,Kettle & Stony Point Sewage Treatment Facility,Kettle & Stony Point First Nation,ON,43.1787,-82.0053,operational,3538,Lambton,51.441,43.9043,41.3875,42.4592,40.0875,28.8604,20.364,thousand m3
24301,Corporation of the Twp. of St. Joseph,Richard's Landing WWTP,Richard's Landing,ON,46.2927,-84.0304,operational,3557,Algoma,47.808,45.121,42.905,40.382,50.062,50.016000000000005,52.303,thousand m3
24322,The Corporation of the Township of Cramahe,WWT  Plant,Colborne,ON,43.9997,-77.8951,operational,3514,Northumberland,571.982,607.726,431.78499999999997,397.206,475.182,439.2641,421.346,thousand m3
24329,Township of St. Clair,Sombra Lagoons,Sombra,ON,42.7048,-82.4786,operational,3538,Lambton,208.63,214.772,149.597,144.727,179.523,197.736,219.353,thousand m3
24330,Township of St. Clair,Port Lambton Lagoons,Port Lambton,ON,42.65,-82.4924,operational,3538,Lambton,193.75900000000001,194.361,100.483,126.34100000000001,229.705,218.455,283.942,thousand m3
24331,Township of St. Clair,Brigden Lagoons,Brigden,ON,42.809,-82.303,operational,3538,Lambton,111.617,86.83800000000001,43.829,82.755,0.0,122.017,72.212,thousand m3
24341,The Corporation of the Municipality of Kincardine,Bruce Energy Centre Lagoon System,Kincardine,ON,44.303,-81.5799,operational,3541,Bruce,249.293,290.447,334.402,256.329,293.758,256.24,300.122,thousand m3
24343,The Corporation of the Municipality of Kincardine,Kincardine Wastewater Lagoon System,Kincardine,ON,44.1576,-81.6397,operational,3541,Bruce,971.5,1044.5810000000001,833.943,890.3290000000001,1099.752,1111.004,1135.261,thousand m3
24345,Town of Petrolia,Petrolia WPCP,Petrolia,ON,42.8676,-82.1562,operational,3538,Lambton,532.4177000000001,395.27750000000003,577.694,634.5640000000001,505.559,650.4870000000001,665.277,thousand m3
24495,Creg Quay,Creg Quay Limited,Bainsville,ON,45.1708,-74.4292,operational,3501,"Stormont, Dundas and Glengarry",23.056,,,,,,,thousand m3
24619,The Corporation of The Nation Municipality,Limoges Lagoon,Casselman,ON,45.2913,-75.1959,operational,3502,Prescott and Russell,655.718,618.818,483.028,530.85,789.974,488.178,407.88100000000003,thousand m3
24620,The Corporation of The Nation Municipality,St Albert Lagoon,St Albert,ON,45.234,-75.1377,operational,3501,"Stormont, Dundas and Glengarry",141.525,88.842,90.895,169.941,142.137,247.201,214.341,thousand m3
24621,The Corporation of The Nation Municipality,St Isidore Lagoon,St Isidore,ON,45.3914,-74.9399,operational,3502,Prescott and Russell,187.92000000000002,231.612,157.296,197.66400000000002,193.488,311.439,277.008,thousand m3
24749,The Corporation of the Township of Clearview,Creemore Waste Water Treatment Plant,Creemore,ON,44.3205,-80.0966,operational,3543,Simcoe,146.32600000000002,157.345,129.832,130.622,124.112,149.45800000000003,138.148,thousand m3
24751,The Corporation of the Township of Clearview,Stayner Waste Water Treatment Plant,Stayner,ON,44.4319,-80.0854,operational,3543,Simcoe,630.394,556.309,439.0,381.851,484.08500000000004,358.91,587.5020000000001,thousand m3
25227,Municipality of Strathroy-Caradoc,Strathroy WPCP,Strathroy,ON,42.9513,-81.6525,operational,3539,Middlesex,2114.462,1588.609,1438.07,1874.676,1920.636,1919.5790000000002,1867.175,thousand m3
25228,Municipality of Strathroy-Caradoc,Mount Brydges WPCP,Mount Brydges,ON,42.542,-81.2812,operational,,,,,,,45.011,61.344,73.333,thousand m3
25231,Nibinamik First Nation,Nibinamik Wastewater System,Nibinamik,ON,52.7361,-88.5036,operational,3560,Kenora,,,,,,,,thousand m3
25306,Seine river first nation,Seine River First Nation,Mine Center,ON,48.7191,-92.4295,operational,3559,Rainy River,65.0,4.0963,2.4192,2.5191999999999997,2.5774000000000004,2.5191999999999997,2.4303000000000003,thousand m3
25339,Naicatchewenin First Nation,Northwest Bay Sewage Lagoon,Devlin,ON,48.8472,-93.5897,operational,3559,Rainy River,15.318,39.009,13.888,25.7955,15.93,24.917,18.6675,thousand m3
25353,Neskantaga Wastewater System,Sewage System,Neskantaga,ON,52.1943,-88.0419,operational,3560,Kenora,,,,,,,,thousand m3
25355,Municipality of the Town of Perth,Perth Sewage Treatment Lagoons,Perth,ON,44.8923,-76.2154,operational,3509,Lanark,2184.0551,2820.6904000000004,2134.9238,1925.0663,2848.7149,2318.0904,2567.9114,thousand m3
25356,Municipality Of South Dundas,Williamsburg Lagoon,Williamsburg,ON,44.9756,-75.2525,operational,3501,"Stormont, Dundas and Glengarry",33.353,51.889,40.0466,48.641,75.223,17.708000000000002,22.354,thousand m3
25357,Municipality Of South Dundas,Morrisburg Wastewater Treatment Plant,Morrisburg,ON,44.8998,-75.1681,operational,3501,"Stormont, Dundas and Glengarry",775.703,635.1694,749.33,728.573,1086.352,770.483,809.702,thousand m3
25358,Municipality Of South Dundas,Iroquois Wastewater Treatment Plant,Iroquois,ON,44.8494,-75.3021,operational,3501,"Stormont, Dundas and Glengarry",1024.497,1008.129,494.77610000000004,713.2620000000001,1073.5084,704.357,654.902,thousand m3
25360,Township of Tay,Port McNicoll Wastewater Treatment Plant,Port McNicoll,ON,44.7544,-79.8059,operational,3543,Simcoe,346.952,485.98,416.73,451.68,505.09000000000003,446.442,443.092,thousand m3
25361,Township of Tay,Victoria Harbour Wastewater Treatment Plant,Victoria Harbour,ON,44.7549,-79.7612,operational,3543,Simcoe,710.543,800.3507,605.4667,618.9914,675.2645,730.0484,833.241,thousand m3
25362,Town of Arnprior,Arnprior WPCC,Arnprior,ON,45.4374,-76.3494,operational,3547,Renfrew,2551.042,2202.185,2032.491,2115.707,2774.776,1914.946,1616.304,thousand m3
25363,Municipality Of Brighton,Brighton WPCP,Brighton,ON,44.0322,-77.7214,operational,3514,Northumberland,1170.078,1251.267,1024.4750000000001,998.029,1475.486,1161.279,1029.037,thousand m3
25365,Township of Severn,West Shore WWTP,Orillia,ON,44.7032,-79.3956,operational,3543,Simcoe,201.704,255.584,221.88600000000002,272.85900000000004,239.322,349.43600000000004,295.51,thousand m3
25366,Township of Severn,Washago Lagoon,Washago,ON,44.7652,-79.3384,operational,3543,Simcoe,,89.57000000000001,,,,,,thousand m3
25369,The Corporation of The Town of Hanover,Hanover Water Pollution Control Plant,Hanover,ON,44.1562,-81.0368,operational,3542,Grey,1420.989,2051.449,1789.001,1622.653,2116.719,2047.9460000000001,1931.603,thousand m3
25506,The Town of Gananoque,Gananoque Sewage Lagoons,Leeds and Thousand Islands,ON,44.3333,-76.1475,operational,3507,Leeds and Grenville,1357.383,1633.0430000000001,1149.5030000000002,1129.868,1682.808,1384.874,1626.133,thousand m3
25621,The Corporation of the Township of Emo,Emo Wastewater Facility,Emo,ON,48.6378,-93.8427,operational,3559,Rainy River,160.228,140.112,133.349,83.76,0.17300000000000001,72.581,192.624,thousand m3
25626,City of Sarnia,Bright's Grove Sewage Lagoon,Bright's Grove,ON,43.0258,-82.2412,operational,3538,Lambton,633.4350000000001,530.145,540.327,407.52,609.835,612.696,515.541,thousand m3
25709,M'Chigeeng First Nation,Lakeview,M'Chigeeng,ON,45.7877,-82.1549,operational,3551,Manitoulin,0.0,45.018,45.018,90.036,90.036,90.036,0.09,thousand m3
25710,M'Chigeeng First Nation,M'Chigeeng Village,M'Chigeeng,ON,45.8362,-82.165,operational,3551,Manitoulin,0.0,0.0,19.0,38.0,38.0,38.0,0.038,thousand m3
25733,The Corporation of The Township of Red Rock,Red Rock Wastewater Plant,Red Rock,ON,48.9414,-88.2521,operational,3558,Thunder Bay,183.05300000000003,204.39530000000002,225.98600000000002,185.936,167.238,97.6974,135.501,thousand m3
25734,The Municipality of Dutton Dunwich,Dutton Sewage Treatment Plant,Dutton,ON,42.6561,-81.5165,operational,3534,Elgin,122.797,108.959,108.914,114.184,123.617,150.339,149.562,thousand m3
25748,Corporation of the Township of Russell,Embrun Sewage Lagoon,Embrun,ON,45.2758,-75.2387,operational,3502,Prescott and Russell,616.914,619.59,351.69100000000003,650.74,1100.393,633.149,754.318,thousand m3
25749,Corporation of the Township of Russell,Russell Sewage Lagoon,Russell,ON,45.2621,-75.3267,operational,3502,Prescott and Russell,308.98900000000003,302.503,201.078,280.971,492.24,425.66700000000003,311.856,thousand m3
25754,Corporation of the Town of Midland,Midland Waste Water Operations,Midland,ON,44.7575,-79.8745,operational,3543,Simcoe,3.2503,3360.79,3124.36,1460.0908,1552.8841,774.4974,2984.5992,thousand m3
25765,Corporation of the Town of Iroquois Falls,Iroquois Falls Sewage Treatment Plant,Iroquois Falls,ON,48.7726,-80.6694,operational,3556,Cochrane,816.0600000000001,1125.303,974.1690000000001,854.7040000000001,905.2930000000001,746.2570000000001,761.255,thousand m3
25768,Corporation of the Town of Iroquois Falls,Porquis Lagoon,Iroquois Falls,ON,48.703,-80.7795,operational,3556,Cochrane,,,,,,,,thousand m3
25786,Corporation of the Township of South Stormont,Ingleside Waste Water Treatment Plant,Ingleside,ON,44.9961,-74.9706,operational,3501,"Stormont, Dundas and Glengarry",1429.342,1419.163,1270.5900000000001,1274.902,1514.284,1399.652,1545.091,thousand m3
25787,Corporation of the Township of South Stormont,Long Sault Waste Water Treatment Plant,Long Sault,ON,45.0267,-74.8854,operational,3501,"Stormont, Dundas and Glengarry",611.252,560.125,479.871,535.594,684.745,537.9290000000001,582.28,thousand m3
25878,The Corporation of the Township of Manitouwadge,Manitouwadge Wastewater Lagoons,Manitouwadge,ON,49.1172,-85.8655,operational,3558,Thunder Bay,540.309,532.977,508.378,419.994,456.671,553.393,657.997,thousand m3
25941,Hamlet of Thorne,Thorne Wastewater Works,Thorne,ON,46.7007,-79.0986,operational,3548,Nipissing,,,,,,,,thousand m3
25947,Corporation of the Town of Kapuskasing,Kapuskasing Waste Water Pollution Control Plant,Kapuskasing,ON,49.4245,-82.4382,operational,3556,Cochrane,1575.35,2467.36,2189.516,2010.354,1638.727,1356.141,1507.534,thousand m3
25982,Township of Lucan Biddulph,Granton WWTP,Granton,ON,43.2078,-81.3002,operational,3539,Middlesex,41.500600000000006,33.166,32.604,35.181000000000004,34.425000000000004,39.286,42.302,thousand m3
26008,Biinjitiwaabik Zaaging Anishinaabek,Biinjitiwaabik Zaaging Anishinaabek Wastewater Treatment plant,MacDiarmid,ON,49.4369,-88.1292,operational,3558,Thunder Bay,,,,,,,,thousand m3
26010,Town of Amherstburg,Boblo Island Sewage Treatment Plant,Amherstburg,ON,42.0994,-83.118,operational,3537,Essex,,41.1161,50.1223,37.0548,35.665600000000005,44.184200000000004,40.4987,thousand m3
26863,Iskatewizaagegan wwtp,Iskatewizaagegan 39 WWTF,kejick,ON,49.6368,-95.0365,operational,3560,Kenora,,,,,,,,thousand m3
26879,SMSI Travel Centres Inc.,Ingersoll Travel Plaza WWTP,Ingersoll,ON,43.0562,-80.8148,operational,3532,Oxford,38.202200000000005,37.8244,36.9504,36.6319,32.8541,37.4225,10.8099,thousand m3
26916,Naotkamegwanning First Nation,Whitefish Bay Wastewater System,Pawitik,ON,49.4102,-93.9532,operational,3560,Kenora,,,,,16.38,32.94,48.959999999999994,thousand m3
27000,Wabaseemoong Independent Nation Wastewater Treatment Facility,Wabaseemoong WWTP,Whitedog,ON,50.1288,-94.9532,operational,3560,Kenora,,,,,,,,thousand m3
27001,Ochiichag WWT,WWT Lagoon,Dalles,ON,49.9061,-94.5402,operational,3560,Kenora,,,,,,,,thousand m3
27037,Wikwemikong Unceded Indian Reserve,Wikwemikong Wastewater Treatment Plant,Wikwemikong,ON,45.8019,-81.7162,operational,3551,Manitoulin,60.1451,271.35609999999997,252.833,247.66500000000002,290.511,261.866,300.76300000000003,thousand m3
27092,The City of North Bay,North Bay Wastewater Treatment Plant,North Bay,ON,46.3019,-79.462,operational,3548,Nipissing,15086.0,15289.753,13950.409,12392.025,13359.214,11405.491,13032.944,thousand m3
27986,Corporation of Municipality of Arran-Elderslie,Chesley Sewage Works,Chesley,ON,44.2921,-81.1114,operational,3541,Bruce,555.691,520.493,401.758,464.579,509.817,429.19,475.533,thousand m3
27987,Corporation of Municipality of Arran-Elderslie,Tara Sewage Lagoon,Tara,ON,44.4688,-81.1578,operational,3541,Bruce,147.798,120.20400000000001,118.125,110.64,178.974,130.828,151.939,thousand m3
27988,Corporation of Municipality of Arran-Elderslie,Paisley Sewage Treatment Plant,Paisley,ON,44.3157,-81.2717,operational,3541,Bruce,161.928,149.85500000000002,124.404,131.478,147.17000000000002,162.995,119.614,thousand m3
28004,Corp. of the City of Timmins,Whitney-Tisdale WPCP,South Porcupine,ON,48.5034,-81.163,operational,3556,Cochrane,,1739.096,1690.0520000000001,1508.2359999999999,2201.33,2815.856,2929.984,thousand m3
28036,Township of South Glengarry,Lancaster WWTP,Lancaster,ON,45.1468,-74.4925,operational,3501,"Stormont, Dundas and Glengarry",442.57,26.6725,283.113,315.25600000000003,270.137,313.363,330.635,thousand m3
28037,Township of South Glengarry,Glen Walter WWTP,Glen Walter,ON,45.0335,-74.6338,operational,3501,"Stormont, Dundas and Glengarry",209.764,221.313,213.92260000000002,209.338,286.661,265.089,285.4,thousand m3
28038,Township of South Glengarry,Green Valley WWTP,Green Valley,ON,45.2551,-74.5728,operational,3501,"Stormont, Dundas and Glengarry",125.802,143.044,71.2796,96.83,113.86,97.784,104.941,thousand m3
28039,Corp. of the City of Timmins,Bob's Lake Sewage Lagoon,Porcupine,ON,48.49,-81.157,operational,3556,Cochrane,,101.151,73.433,144.26670000000001,63.064,71.20700000000001,99.735,thousand m3
28196,The Corporation of the Municipality of Central Elgin,Port Stanley Wastewater Treatment Facility,Southwold,ON,42.6762,-81.234,operational,3534,Elgin,289.174,396.272,248.162,331.808,462.719,438.9406,568.459,thousand m3
28197,The Corporation of the Municipality of Central Elgin,Belmont Wastewater Treatment Facility,Central Elgin,ON,42.8692,-81.0998,operational,3534,Elgin,256.906,257.937,181.661,207.186,216.721,203.89000000000001,332.622,thousand m3
28254,The Corporation of the Township of Ramara,Lagoon City Sewage Treatment Plant,Ramara,ON,44.5582,-79.2072,operational,3543,Simcoe,519.3240000000001,625.513,507.382,471.70770000000005,561.9490000000001,513.8,519.9250000000001,thousand m3
28420,CORPORATION OF THE TOWN OF HAWKESBURY,Hawkesbury Wastewater Plant,Hawkesbury,ON,45.6119,-74.5964,operational,3502,Prescott and Russell,2404.852,2328.304,2847.672,3497.6270000000004,3138.078,2577.746,2640.286,thousand m3
28444,The Corporation of the Township of North Glengarry,Alexandria Sewage Works,Alexandria,ON,45.3228,-74.6172,operational,3501,"Stormont, Dundas and Glengarry",1594.6485,1295.7899,1123.3825000000002,869.4240000000001,1701.2011000000002,1240.2677,1717.1025,thousand m3
28446,The Corporation of the Township of North Glengarry,Maxville Sewage Works,Maxville,ON,45.317,-74.8883,operational,3501,"Stormont, Dundas and Glengarry",139.8006,246.86860000000001,144.6479,210.88,249.531,237.322,210.512,thousand m3
28471,Township of Bonnechere Valley,Eganville Sewage Treatment Plant,Eganville,ON,45.5369,-77.0955,operational,3547,Renfrew,196.137,213.749,183.422,218.346,229.4088,191.60500000000002,246.99800000000002,thousand m3
28536,The Corporation of the Municipality of Wawa,Wawa Sewage Treatment Facility,Wawa,ON,47.9831,-84.7935,operational,3557,Algoma,766.9250000000001,819.96,913.011,880.898,676.077,758.113,796.572,thousand m3
28594,Village of Casselman,Casselman Waste Treatment,Casselman,ON,45.3256,-75.0792,operational,3502,Prescott and Russell,459.582,449.402,454.983,404.94800000000004,528.542,545.92,525.8,thousand m3
28893,Lac La Croix First Nation,Lac La Croix Lagoon,fort frances,ON,48.3857,-92.1655,operational,3559,Rainy River,,,,,,,,thousand m3
28898,The Corporation of the City of Elliot Lake,Esten Lake Sewage Treatment Plant,Elliot Lake,ON,46.3531,-82.6436,operational,3557,Algoma,2732.339,1894.625,2016.093,2133.82,2415.3360000000002,2411.741,3057.762,thousand m3
28907,Corporation of the Municipality of West Nipissing,Sturgeon Falls,Sturgeon Falls,ON,46.3616,-79.9403,operational,3548,Nipissing,2419.432,2372.195,2007.193,2020.949,2218.764,1981.19,2209.45,thousand m3
29412,Rainy River First Nation,Rainy River First Nation Lagoon,emo,ON,48.6349,-93.9209,operational,3559,Rainy River,13.0,13.0,26.0,13.0,,,,thousand m3
29577,The Corporation of the City of Quinte West,Stonecrest Estates Sewage Treatment Plant,Quinte West (Bayside),ON,44.1231,-77.477,operational,3512,Hastings,,,,,,,,thousand m3
29613,The Corporation of the City of Kingston,Cana Wastewater Treatment Plant,Kingston,ON,44.2994,-76.429,operational,3510,Frontenac,,,,,,46.107600000000005,36.3055,thousand m3
29692,The Corporation of the Municipality of Trent Hills,Warkworth Waste Stabilization Ponds,Warkworth,ON,44.2009,-77.8762,operational,3514,Northumberland,32.85,50.714,44.2575,35.405,44.895,65.33500000000001,52.56,thousand m3
29719,The Corporation of the Municipality of St.-Charles,St. Charles Sewage Lagoon,St. Charles,ON,46.2905,-80.3709,operational,3552,Sudbury,,,,0.0,,0.0,0.0,thousand m3
29761,Municipality of Grey Highlands,Flesherton Wastwater Treatment Plant,Flesherton,ON,44.2626,-80.5644,operational,3542,Grey,46.867000000000004,71.763,57.617000000000004,70.626,69.01,53.613,32.563,thousand m3
29763,Regional Municipality of Durham,Nonquon WPCP (new),Port Perry,ON,44.12,-78.9713,operational,3518,Durham,,,,,1071.52,1073.179,1098.7020000000002,thousand m3
29993,Municipality of Thames Centre,Thorndale Wastewater Treatment Plant,Thorndale,ON,43.0951,-81.1643,operational,3539,Middlesex,,,,,79.25,91.0523,107.13300000000001,thousand m3
30444,Muskrat Dam First Nation (213),Muskrat Dam Lagoon,Muskrat Dam,ON,53.4106,-91.7727,operational,3560,Kenora,,,,,,,,thousand m3
30445,Pikangikum First Nation (208),Pikangikum Lagoon,Pikangikum,ON,51.8073,-93.9662,operational,3560,Kenora,,,,,,,,thousand m3
30468,Kiashke Zaaging Anishinaabek,Gull Bay Wastewater Lagoon,Gull Bay First Nation,ON,49.8063,-89.1153,operational,3558,Thunder Bay,,,,68.0,,,,thousand m3
30492,Deer Lake First Nation,Deer Lake RBC,Deer Lake,ON,52.6188,-94.0507,operational,3560,Kenora,,,,,,,,thousand m3
30493,Poplar Hill First Nation,Poplar Hill RBC Plant,Poplar Hill First Nation,ON,52.0986,-94.3087,operational,3560,Kenora,,,,,,,,thousand m3
30494,Fort Severn First Nation,Fort Severn Lagoon,Fort Severn,ON,56.0004,-87.6289,operational,3560,Kenora,,,,,,,,thousand m3
30495,Keewaywin First Nation,Keewaywin Lagoon,Keewaywin FN,ON,53.0144,-92.7847,operational,3560,Kenora,,,,,,,,thousand m3
30496,North Spirit Lake First Nation,North Spirit Lake RBC,North Spirit Lake,ON,52.5098,-93.019,operational,3560,Kenora,,,,,,,,thousand m3
30578,Aroland First Nation,Aroland Lagoon,Aroland First Nation,ON,50.224,-86.9631,operational,3558,Thunder Bay,,,,,,,,thousand m3
30579,Eabametoong First Nation,Eabametoong Lagoon,Eabametoong,ON,51.5649,-87.8763,operational,3560,Kenora,,,,,,,,thousand m3
30580,Marten Falls First Nation,Marten Falls Lagoon,Marten Falls First Nation,ON,51.6319,-85.9112,operational,3560,Kenora,,,,,,,,thousand m3
30794,Ontario Infrastructure and Lands Corporation,Waypoint Wastewater Treatment Plant,Penetanguishene,ON,44.8059,-79.9301,operational,3543,Simcoe,,,,,,56.3193,68.92750000000001,thousand m3
36815,Wauzhushk Onigum,Rat Portage Waste Water RBC,Wauzhushk Onigum First Nation,ON,49.4435,-94.2854,operational,3560,Kenora,,,,,,,47.447,thousand m3
43860,Township of East-Hawkesbury,Chute  Blondeau WPCP,Chute  Blondeau,ON,45.588,-74.465,operational,3502,Prescott and Russell,,,,,,9.111,23.977,thousand m3
43869,Attawapiskat First Nation,Attawapiskat Lagoon,Attawapiskat,ON,52.9314,-82.9362,operational,3560,Kenora,,,,,,,,thousand m3
43870,Fort Albany First Nation,FAFN Lagoon,Fort Albany,ON,52.2073,-81.6677,operational,3556,Cochrane,,,,,,,,thousand m3
43872,Kashechewan First Nation,Kashchewan Lagoon,Kashechewan,ON,52.3022,-81.6265,operational,3560,Kenora,,,,,,,,thousand m3
48897,Cat Lake First Nation,Cat Lake,Cat Lake,ON,51.7291,-91.8094,operational,3560,Kenora,,,,,,,,thousand m3
49896,Sachigo Lake First Nation,Sachigo First Nation,Sachigo First Nation,ON,53.8799,-92.1692,operational,3560,Kenora,,,,,,65.0,65.0,thousand m3
51896,Bearskin Lake First Nation,Bearskin Lake Lagoon,Bearskin Lake,ON,53.9307,-90.9845,operational,3560,Kenora,,,,,,,,thousand m3
51897,North Caribou First Nation,North Caribou Lagoon,North Caribou Lake,ON,52.9616,-91.3393,operational,3560,Kenora,,,,,,0.0,0.32,thousand m3
53956,Sandy Lake FN,Sandy Lake FN Lagoon,Sandy Lake,ON,53.0601,-93.2982,operational,3560,Kenora,,,,,,,,thousand m3
56359,Town of Mattawa,Mattawa Wastewater Treatment Lagoon,Mattawa,ON,46.3118,-78.731,operational,3548,Nipissing,,,,,,,366.741,thousand m3
56861,Big Trout Lake First Nation,K.I. Wastewater System,Big Trout Lake,ON,53.8222,-89.9098,operational,3560,Kenora,,,,,,,,thousand m3
58462,Regional Municipality of Niagara,Niagara-on-the-Lake WWTP,Niagara-on-the-Lake,ON,43.2545,-79.1118,operational,3526,Niagara,,,,,,,,thousand m3
58813,Town of Amherstburg,Big Creek Marsh STP,Amherstburg,ON,42.0389,-83.0781,operational,3537,Essex,,,,,,,42.4623,thousand m3
23847,,,,,,,,,,0.0,,,,,,,thousand m3
25662,,,,,,,,,,0.0,0.0,,,,,,thousand m3
