23646,Municipality of Middlesex Centre,Ilderton WWTF,Ilderton,ON,43.0769,-81.3668,operational,3539,Middlesex,272.623,254.81400000000002,234.051,258.451,256.66,314.365,345.3,thousand m3
23647,InnServices Utilities Inc.,Lakeshore WPCP,Innisfil,ON,44.2933,-79.5343,operational,3543,Simcoe,3042.2380000000003,3162.482,2834.184,3293.9,3890.675,3687.879,3422.439,thousand m3
23670,Mohawk Council of Akwesasne,Block 97 RBC,Akwesasne,ON,45.0023,-74.7626,operational,3501,"Stormont, Dundas and Glengarry",,,,,,,,thousand m3
23672,Corporation of the Municipality of Central Huron,Town of Clinton Sewage Treatment Plant,Clinton,ON,43.6054,-81.539,operational,3540,Huron,1110.26,953.5160000000001,740.206,926.106,1152.557,924.3620000000001,900.923,thousand m3
23677,Corporation Town of Smiths Falls,Smiths Falls Water Pollution Control Plant,Smiths Falls,ON,44.8922,-76.0,operational,3509,Lanark,4700.953,3348.6820000000002,3252.849,3461.937,3545.982,3956.349,3768.236,thousand m3
23678,The Corporation of the Municipality of West Grey,Durham WWTP,Durham,ON,44.1718,-80.8267,operational,3542,Grey,356.699,412.97200000000004,301.318,321.478,358.0528,256.199,255.9,thousand m3
23679,The Corporation of the Municipality of West Grey,Neustadt Lagoons,Neustat,ON,44.082,-80.9938,operational,3542,Grey,104.784,64.528,39.042,52.392,77.061,76.89,89.52,thousand m3
23688,Township of Minden Hills,Minden Wastewater Treatment Plant,Minden,ON,44.9171,-78.7328,operational,3546,Haliburton,240.477,252.472,208.982,236.205,264.47,203.31600000000003,212.404,thousand m3
23691,Regional Municipality of Waterloo,Ayr Wastewater Treatment Plant,Ayr,ON,43.2813,-80.4651,operational,3530,Waterloo,525.963,480.48199999999997,454.935,480.447,555.972,497.449,440.21569999999997,thousand m3
23692,Regional Municipality of Waterloo,Elmira Wastewater Treatment Plant,Elmira,ON,43.5913,-80.5501,operational,3530,Waterloo,1876.007,1471.473,1173.4830000000002,1342.895,1645.446,1500.616,1349.4539,thousand m3
23693,Regional Municipality of Waterloo,Hespeler Wastewater Treatment Plant,Cambridge,ON,43.4238,-80.3292,operational,3530,Waterloo,2516.9006,2297.3698000000004,2183.6524,2325.7726,2418.7780000000002,2387.9741,2230.5559000000003,thousand m3
23695,Regional Municipality of Waterloo,St. Jacobs Wastewater Treatment Plant,St. Jacobs,ON,43.5354,-80.5485,operational,3530,Waterloo,378.999,352.223,261.90500000000003,310.385,363.928,322.177,326.38800000000003,thousand m3
23696,Regional Municipality of Waterloo,Wellesley Wastewater Treatment Plant,Wellesley,ON,43.4678,-80.7599,operational,3530,Waterloo,292.959,299.1812,245.867,291.65700000000004,333.29900000000004,287.3671,308.7365,thousand m3
23709,Municipality of North Middlesex,Ailsa Craig Wastewater Treatment Plant,Ailsa Craig,ON,43.1483,-81.5473,operational,3539,Middlesex,272.371,228.9373,196.4837,243.9375,255.707,262.6268,247.7584,thousand m3
23710,Municipality of North Middlesex,Parkhill Wastewater Lagoon,Parkhill,ON,43.1759,-81.6892,operational,3539,Middlesex,198.09900000000002,214.70579999999998,168.40200000000002,198.119,234.442,216.3723,272.0093,thousand m3
23711,Municipality of Bluewater,Bayfield Wastewater Lagoons,Bayfield,ON,43.56,-81.6552,operational,3540,Huron,235.24370000000002,529.4056999999999,321.72240000000005,418.10940000000005,451.451,392.2398,421.6564,thousand m3
23712,Municipality of Bluewater,Hensall Wastewater Lagoon,Hensall,ON,43.4205,-81.5081,operational,3540,Huron,141.592,301.6916,65.1209,147.70000000000002,159.953,143.8495,164.2268,thousand m3
23713,Municipality of Bluewater,Zurich Wastewater Lagoons,Zurich,ON,43.4177,-81.6134,operational,3540,Huron,105.2944,160.1816,98.054,88.4118,98.146,93.2205,108.3847,thousand m3
23715,Township of Lucan Biddulph,Lucan Wastewater Treatment Plant,Lucan,ON,43.2038,-81.4125,operational,3539,Middlesex,256.927,272.8286,284.908,338.304,332.726,362.556,389.932,thousand m3
23716,Town of St. Marys,St. Marys Wastewater Treatment Plant,St. Marys,ON,43.251,-81.1498,operational,3531,Perth,1260.9494,1692.441,1493.126,1685.4630000000002,1572.3690000000001,1763.0674000000001,1613.931,thousand m3
23717,County of Brant,Cainsville Wastewater Treatment Lagoon,Cainsville,ON,43.1476,-80.1786,operational,3529,Brant,60.43,70.06700000000001,53.6,26.019000000000002,85.11489999999999,73.68,91.297,thousand m3
23718,County of Brant,Paris Water Pollution Control Plant,Paris,ON,43.179,-80.3742,operational,3529,Brant,1360.432,1395.961,1224.394,1251.7930000000001,1393.138,1421.337,1626.525,thousand m3
23719,County of Brant,St. George Water Pollution Control Plant,St. George,ON,43.2382,-80.2428,operational,3529,Brant,240.574,245.103,219.548,220.368,243.4243,263.1939,271.718,thousand m3
23720,Village of Point Edward WPCP,Village of Point Edward WPCP,Point Edward,ON,42.9975,-82.4196,operational,3538,Lambton,599.244,588.331,442.54859999999996,596.1539,571.4706,615.745,732.3721,thousand m3
23741,Regional Municipality of Durham,Newcastle WPCP,Newcastle,ON,43.8979,-78.5948,operational,3518,Durham,1129.121,1107.598,1010.409,988.268,1165.338,1142.383,1152.7730000000001,thousand m3
23742,Regional Municipality of Durham,Nonquon WPCP,Port Perry,ON,44.12,-78.9713,decommissioned,3518,Durham,1169.066,1166.17,931.1560000000001,846.328,60.982,,,thousand m3
23743,Regional Municipality of Durham,Uxbridge WPCP,Uxbridge,ON,44.1141,-79.1212,operational,3518,Durham,1215.342,1454.396,1340.536,1186.0230000000001,1246.4560000000001,1283.833,1382.6100000000001,thousand m3
23744,Regional Municipality of Durham,Cannington WPCP (Lagoon),Cannington,ON,44.3565,-79.0317,operational,3518,Durham,407.567,372.688,269.47700000000003,315.48900000000003,454.987,348.9282,356.657,thousand m3
23745,Regional Municipality of Durham,Sunderland WPCP (Lagoon),Sunderland,ON,44.1141,-79.1212,operational,3518,Durham,111.428,134.31300000000002,102.11800000000001,82.142,142.919,138.2174,66.768,thousand m3
23746,Regional Municipality of Durham,Lake Simcoe WPCP,Beaverton,ON,44.4172,-79.1642,operational,3518,Durham,709.432,590.3290000000001,478.954,638.274,723.123,640.33,668.0999999999999,thousand m3
23752,Municipality of Thames Centre,Dorchester WWTP,Dorchester,ON,42.975,-81.0314,operational,3539,Middlesex,143.3738,139.032,117.898,117.0838,106.29260000000001,113.1611,118.39930000000001,thousand m3
23753,Corporation of the Township of Huron Kinloss,Ripley WW,Ripley,ON,44.06,-81.5756,operational,3541,Bruce,216.15,198.58,206.969,0.18080000000000002,225.91,155.138,213.214,thousand m3
23756,Corporation of Loyalist Township,Bath Sewage Treatment Plant,Bath,ON,44.1852,-76.7582,operational,3511,Lennox and Addington,398.314,446.67,625.755,673.855,614.2090000000001,575.833,581.345,thousand m3
23757,Corporation of Loyalist Township,Amherstview Water Pollution Control Plant,Amherstview,ON,44.2348,-76.6566,operational,3511,Lennox and Addington,1507.359,1536.1460000000002,1369.06,1251.147,1304.8760000000002,1150.711,1094.6451000000002,thousand m3
23761,Town of Deep River,Deep River Sewage Treatment Plant,Deep River,ON,46.103,-77.4772,operational,3547,Renfrew,930.298,1102.591,957.7307000000001,829.8244,921.0188,893.7023,861.2428,thousand m3
23762,Town of Petawawa,Petawawa Wastewater Treatment Plant,Petawawa,ON,45.9008,-77.2483,operational,3547,Renfrew,2180.223,2023.096,1563.555,1572.3580000000002,1613.333,1625.923,1615.003,thousand m3
23763,Town of Carleton Place,Carleton Place Wastewater Treatment Plant,Carleton Place,ON,45.1458,-76.1383,operational,3509,Lanark,2209.0669000000003,2406.2113,1719.6361,1946.6299,2679.9522,2251.7205,2230.6604,thousand m3
23764,Village of Merrickville-Wolford,Merrickville Wolford Wastewater Treatment Plant,Merrickville,ON,44.9141,-75.8286,operational,3507,Leeds and Grenville,247.2346,267.0958,200.517,204.117,294.8917,215.02100000000002,208.216,thousand m3
23765,Municipality of Mississippi Mills,Mississippi Mills Wastewater Treatment Plant,Almonte,ON,45.2165,-76.2122,operational,3509,Lanark,969.8778000000001,1029.4888,760.4492,853.7911000000001,1312.6746,1201.2467000000001,1223.7077,thousand m3
23766,Town of Renfrew,Renfrew Water Pollution Control Plant,Renfrew,ON,45.4807,-76.6858,operational,3547,Renfrew,2126.1112,3167.3994000000002,1910.787,2099.4120000000003,2669.781,1738.152,1983.5529999999999,thousand m3
23767,Town of Bancroft,Bancroft Wastewater Treatment Facility,Bancroft,ON,45.0493,-77.8339,operational,3512,Hastings,391.747,404.621,327.5176,367.77700000000004,400.321,427.00320000000005,481.1403,thousand m3
23768,Township of Madawaska Valley,Barry's Bay Wastewater Treatment Plant,Barry's Bay,ON,45.4795,-77.6769,operational,3547,Renfrew,159.467,148.969,146.736,140.799,159.739,140.058,148.404,thousand m3
23769,"Township of Killaloe, Hagerty and Richards",Killaloe Wastewater Treatment Plant,Killaloe,ON,45.5647,-77.412,operational,3547,Renfrew,129.846,113.79400000000001,88.451,122.44800000000001,214.281,99.094,106.91,thousand m3
23770,the Corportation of the Town of Penetanguishene,Philip H. Jones Pollution Control Plant,Penetanguishene,ON,44.7719,-79.9389,operational,3543,Simcoe,1131.9544,1356.7620000000002,1193.093,1206.16,1261.7730000000001,1194.721,1175.629,thousand m3
23772,City of Greater Sudbury,Valley East WWTP,Val Caron,ON,46.623,-81.0198,operational,3553,Greater Sudbury / Grand Sudbury,2249.8810000000003,2507.94,2300.745,2273.202,2212.77,1984.047,2413.84,thousand m3
23773,City of Greater Sudbury,Azilda WWTP,Azilda,ON,46.5521,-81.1548,operational,3553,Greater Sudbury / Grand Sudbury,788.335,841.972,692.454,650.976,711.035,641.6270000000001,816.712,thousand m3
23774,City of Greater Sudbury,Chelmsford WWTP,Chelmsford,ON,46.5664,-81.2113,operational,3553,Greater Sudbury / Grand Sudbury,1726.095,1431.499,1510.506,1491.247,1905.901,1272.743,1826.7890000000002,thousand m3
23775,City of Greater Sudbury,Dowling WWTP,Dowling,ON,46.5966,-81.3278,operational,3553,Greater Sudbury / Grand Sudbury,748.7270000000001,768.0989999999999,759.909,756.214,765.725,695.868,755.303,thousand m3
23776,City of Greater Sudbury,Coniston WWTP,Coniston,ON,46.4878,-80.8402,operational,3553,Greater Sudbury / Grand Sudbury,490.57800000000003,469.378,509.14700000000005,679.62,603.069,516.546,631.479,thousand m3
23777,City of Greater Sudbury,Walden WWTP,Walden,ON,46.4041,-81.177,operational,3553,Greater Sudbury / Grand Sudbury,1034.899,1066.633,1123.585,929.2460000000001,1020.089,710.751,1022.479,thousand m3
23778,City of Greater Sudbury,Lively WWTP,Lively,ON,46.432,-81.1436,operational,3553,Greater Sudbury / Grand Sudbury,665.796,625.754,523.3910000000001,670.067,663.307,584.909,418.124,thousand m3
23779,City of Greater Sudbury,Levack WWTP,Levack,ON,46.6415,-81.3973,operational,3553,Greater Sudbury / Grand Sudbury,284.425,257.76599999999996,224.81,216.172,226.319,262.86400000000003,314.817,thousand m3
23780,City of Greater Sudbury,Wahnapitae Sewage Treatment Lagoon,Wahnapitae,ON,46.4761,-80.7957,operational,3553,Greater Sudbury / Grand Sudbury,265.0,280.0,208.5,190.0,180.0,172.695,466.51800000000003,thousand m3
23784,Township of Cavan Monaghan,Millbrook Wastewater Treatment Plant,Millbrook,ON,44.1563,-78.4442,operational,3515,Peterborough,328.798,313.863,197.7768,194.6951,282.703,263.457,291.074,thousand m3
23785,City of Kawartha Lakes,Bobcaygeon Wastewater Treatment Plant,Bobcaygeon,ON,44.5432,-78.5325,operational,3516,Kawartha Lakes,866.2860000000001,875.944,775.673,917.961,1183.0399,1068.3945,918.211,thousand m3
23786,City of Kawartha Lakes,Coboconk Wastewater Treatment Lagoon,Coboconk,ON,44.6604,-78.7994,operational,3516,Kawartha Lakes,59.25,102.74300000000001,74.422,82.6579,73.902,84.91610000000001,149.93810000000002,thousand m3
23787,City of Kawartha Lakes,Fenelon Falls Wastewater Treatment Plant,Fenelon Falls,ON,44.524,-78.734,operational,3516,Kawartha Lakes,322.197,404.553,374.327,382.63620000000003,473.48850000000004,408.2867,415.0369,thousand m3
23788,The Regional Municipality of Halton,Acton Wastewater Treatment Plant,Halton Hills (Acton),ON,43.6278,-80.0225,operational,3524,Halton,1582.088,1425.949,1532.251,1449.748,1522.033,1353.092,1386.8890000000001,thousand m3
23789,The Corporation of the Township of Alfred and Plantagenet,Alfred Wastewater Treatment Lagoon,Alfred,ON,45.5423,-74.887,operational,3502,Prescott and Russell,183.87,163.427,238.388,317.8,109.03,134.178,233.967,thousand m3
23790,The Corporation of the Township of Alfred and Plantagenet,Plantagenet Wastewater Treatment Lagoon,Plantagenet,ON,45.5349,-74.9846,operational,3502,Prescott and Russell,191.418,171.453,168.50300000000001,147.211,210.832,155.548,179.68200000000002,thousand m3
23791,The Corporation of the Township of Alfred and Plantagenet,Wendover Wastewater Treatment Plant,Wendover,ON,45.5679,-75.1179,operational,3502,Prescott and Russell,172.21,198.919,192.73,196.941,238.524,184.866,184.667,thousand m3
23792,City of Clarence-Rockland,Rockland Wastewater Treatment Plant,Rockland,ON,45.5591,-75.2782,operational,3502,Prescott and Russell,1394.7,1508.121,1422.395,1587.464,1843.367,1611.419,1677.524,thousand m3
23793,Township of Champlain,L'Orignal Wastewater Treatment Plant,L'Orignal,ON,45.6272,-74.6778,operational,3502,Prescott and Russell,349.63800000000003,378.87850000000003,369.5301,376.25059999999996,401.65250000000003,333.15200000000004,316.7602,thousand m3
23794,Township of Champlain,Vankleek Hill Wastewater Treatment Lagoon,Vankleek Hill,ON,45.5088,-74.6391,operational,3502,Prescott and Russell,456.38,369.7225,322.837,414.327,549.835,357.229,357.633,thousand m3
23798,The Corporation of the Village of Newbury,Newbury Wastewater Treatment Plant,Newbury,ON,42.6796,-81.8022,operational,3539,Middlesex,30.8876,30.0267,28.552,27.4534,27.4969,32.1006,32.5651,thousand m3
23803,Corporation of the Township of Perth East,Milverton Lagoon,Milverton,ON,43.5674,-80.934,operational,3531,Perth,341.85200000000003,197.024,112.19,229.38,211.55,196.17000000000002,169.4567,thousand m3
23807,The Corporation of the Municipality of Marmora and Lake,Marmora Waste Water Treatment Facility,Marmora,ON,44.4704,-77.675,operational,3512,Hastings,188.9915,211.37,206.0289,237.1619,251.1037,247.4062,258.4691,thousand m3
23810,Regional Municipality of Durham,Pringle Creek WPCP #2,Whitby,ON,43.8649,-78.9294,decommissioned,3518,Durham,1061.166,0.0,,,,,,thousand m3
23814,Chippewas of the Thames First Nation Chief and Council,COTTFN Wastewater Treatment Plant,Muncey,ON,42.8167,-81.4726,operational,3539,Middlesex,39.8207,14.7167,12.8649,15.7082,14.9552,16.613,17.5445,thousand m3
23828,The Corporation of the Town of Goderich,Goderich Water Pollution Control Plant,Goderich,ON,43.7307,-81.7235,operational,3540,Huron,2319.566,2247.179,2099.885,2391.54,2405.308,2118.809,1948.058,thousand m3
23830,Corporation of the City of Pembroke,Pembroke Pollution Control Centre,Pembroke,ON,45.8248,-77.0842,operational,3547,Renfrew,4333.737,5604.979,4909.406,12674.295999999998,5549.907,4204.678,4735.463,thousand m3
23843,Corporation of the Township of Whitewater Region,Cobden Wastewater Treatment Plant,Cobden,ON,45.6255,-76.8754,operational,3547,Renfrew,52.937,248.927,220.942,246.123,312.466,240.62,267.531,thousand m3
23846,The Corporation of the Municipality of Highlands East,Cardiff Sewage Lagoon,Cardiff,ON,44.9885,-78.018,operational,3546,Haliburton,118.717,56.878,48.409,312.863,80.871,52.594800000000006,71.9579,thousand m3
23872,The Corporation of the City of Quinte West,Frankford WWTP,Quinte West,ON,44.2095,-77.5977,operational,3512,Hastings,743.7505,823.572,710.4768,806.0041,909.8351,912.8154,956.8285000000001,thousand m3
23874,The Corporation of the City of Quinte West,Batawa WWTP,Quinte West,ON,44.1642,-77.5885,operational,3512,Hastings,160.4069,199.3559,263.6067,147.1566,218.34140000000002,216.31900000000002,212.4149,thousand m3
23876,City of Greater Sudbury,Capreol Sewage Treatment Lagoon,Capreol,ON,46.7002,-80.931,operational,3553,Greater Sudbury / Grand Sudbury,871.2550000000001,1081.817,876.764,832.1560000000001,674.943,667.7280000000001,685.27,thousand m3
23877,City of Greater Sudbury,Falconbridge WWTP,Falconbridge,ON,46.5679,-80.8064,operational,3553,Greater Sudbury / Grand Sudbury,89.302,88.31200000000001,87.786,129.74200000000002,232.627,132.983,91.387,thousand m3
23897,The Corporation of the Township of Edwardsburgh/Cardinal,Cardinal Wastewater Treatment Plant,Cardinal,ON,44.7905,-75.3726,operational,3507,Leeds and Grenville,448.857,447.74,298.135,328.879,468.403,360.937,333.68000000000006,thousand m3
23898,The Corporation of the Township of Edwardsburgh/Cardinal,Spencerville Lagoons,Spencerville,ON,44.8488,-75.5337,operational,3507,Leeds and Grenville,62.546,97.933,77.2,99.877,128.797,82.952,79.915,thousand m3
23911,The Corporation of the Municipality of Port Hope,Sewage Treatment Plant,Port Hope,ON,43.9519,-78.2687,operational,3514,Northumberland,2002.0890000000002,2171.665,1644.005,1522.809,2341.618,1946.25,2203.924,thousand m3
23929,Corporation of the Municipality of South Huron,Exeter Wastewater Treatment Facility,Exeter,ON,43.3589,-81.4974,operational,3540,Huron,958.512,1616.833,1058.559,1151.1200000000001,1420.844,971.008,1157.189,thousand m3
23934,HMS Host,Mallorytown North OnRoute Service Center,Mallorytown,ON,44.3013,-75.4811,operational,,,,,,,,,,thousand m3
23935,HMS Host,Napanee OnRoute Service Center,Napanee,ON,44.1792,-76.9303,operational,3511,Lennox and Addington,,,,,,,,thousand m3
23949,Chippewas of Rama First Nation,RFN wastewater treatment,Rama,ON,44.6512,-79.3368,operational,3543,Simcoe,385.046,380.222,350.438,339.702,337.058,317.711,220.644,thousand m3
23964,the Corportation of the Town of Penetanguishene,Fox W.P.C.P.,Penetanguishene,ON,44.7841,-79.9347,operational,3543,Simcoe,277.827,284.706,214.274,270.771,283.346,227.7716,203.401,thousand m3
23973,The Corporation of the Township of Pickle Lake,Pickle Lake WPCP,Pickle Lake,ON,51.4918,-90.1812,operational,3560,Kenora,119.46600000000001,152.63500000000002,165.991,154.453,147.269,171.489,184.731,thousand m3
23974,The Corporation of the Township of Schreiber,Schreiber WPCP,Schreiber,ON,48.7993,-87.2717,operational,3558,Thunder Bay,335.73,422.725,430.384,319.85900000000004,411.18800000000005,310.982,326.362,thousand m3
23975,Corporation of the Town of Cobourg,Water Pollution Control Plant #1,Cobourg,ON,43.9599,-78.1825,operational,3514,Northumberland,2877.534,3009.0,3086.8540000000003,2916.34,3555.197,3582.635,3238.188,thousand m3
23976,Corporation of the Town of Cobourg,Water Pollution Control Plant #2,Cobourg,ON,43.9614,-78.1234,operational,3514,Northumberland,1758.3600000000001,1757.666,1787.007,1733.7240000000002,2278.117,1960.851,1907.723,thousand m3
23985,Corporation of the Town of Lakeshore,Comber Wastewater Lagoons,Comber,ON,42.2255,-82.5462,operational,3537,Essex,104.413,130.9702,97.128,113.7202,83.61189999999999,132.5665,92.9554,thousand m3
23986,Corporation of the Town of Lakeshore,Stoney Point Wastewater Lagoons,Stoney Point,ON,42.3016,-82.5142,operational,3537,Essex,274.343,339.41200000000003,357.4494,382.59240000000005,255.5259,413.728,243.07489999999999,thousand m3
24041,The Corporation of the Township of Southgate,Dundalk Wastewater Treatment Plant,Dundalk,ON,44.1533,-80.3836,operational,3542,Grey,505.962,49.4185,389.776,334.685,420.598,404.858,407.659,thousand m3
24046,Grassy Narrows,Grassy Narrows Wastewater Treatment Facility,Grassy Narrows,ON,50.1513,-93.9883,operational,3560,Kenora,,,,,,,,thousand m3
24065,The Regional Municipality of York,Holland Landing WPCP,Holland Landing,ON,44.1194,-79.4844,operational,3519,York,439.354,407.648,265.75,314.91040000000004,445.47990000000004,359.8942,231.9396,thousand m3
24066,Mississaugas of The New Credit First Nation,MNCFN Wastewater,Hagersville,ON,43.0135,-80.0996,operational,3529,Brant,56.642,77.303,93.22980000000001,37.869,139.735,106.217,131.591,thousand m3
24072,Corporation of the Township of Armstrong,Earlton Lagoon,Armstrong,ON,47.7142,-79.8378,operational,3554,Timiskaming,218.543,153.65,200.67000000000002,233.619,233.619,250.013,204.75300000000001,thousand m3
24080,The Regional Municipality of York,Mount Albert WPCP,Mount Albert,ON,44.1557,-79.3048,operational,3519,York,315.831,308.50600000000003,278.1243,294.87440000000004,351.6787,347.3562,321.9178,thousand m3
24081,The Regional Municipality of York,Nobleton WPCP,Nobleton,ON,43.8895,-79.6899,operational,3519,York,265.348,317.77,358.1138,405.3474,507.501,509.186,510.754,thousand m3
24082,The Regional Municipality of York,Schomberg WPCP,Schomberg,ON,44.0085,-79.6675,operational,3519,York,326.705,333.90200000000004,345.409,312.10380000000004,401.944,429.233,384.39,thousand m3
24083,The Regional Municipality of York,Kleinburg WPCP,Kleinburg,ON,43.8367,-79.63,operational,3519,York,428.743,448.832,359.2469,988.8950000000001,442.84000000000003,465.714,507.194,thousand m3
24085,The Regional Municipality of York,Sutton WPCP,Sutton,ON,44.3105,-79.3486,operational,3519,York,606.567,621.62,575.2603,605.0550000000001,684.9897000000001,753.878,682.2,thousand m3
24109,District Municipality of Muskoka,Mountview WWTP,Huntsville,ON,45.3252,-79.2135,operational,3544,Muskoka,940.816,941.2560000000001,985.626,1072.92,1189.518,1010.528,1044.267,thousand m3
24110,The Corporation of the Municipality of South Bruce,Mildmay WWTP,Mildmay,ON,44.0506,-81.1223,operational,3541,Bruce,192.455,187.196,544.994,179.364,167.55,173.61,176.493,thousand m3
24111,District Municipality of Muskoka,Golden Pheasant WWTP,Huntsville,ON,45.3456,-79.1704,operational,3544,Muskoka,1015.515,726.8420000000001,1097.036,669.406,839.838,791.2338,806.2513000000001,thousand m3
24112,The Corporation of the Municipality of South Bruce,Teeswater Formosa WWTP,Teeswater,ON,44.0114,-81.2631,operational,3541,Bruce,36.397,336.4928,378.911,424.625,392.67600000000004,357.594,340.212,thousand m3
24113,District Municipality of Muskoka,Birch Glen WWTP,Baysville,ON,45.1601,-79.1063,operational,3544,Muskoka,81.525,39.862,45.67,48.182500000000005,62.074,45.5662,45.2862,thousand m3
24114,District Municipality of Muskoka,Lagoon Lane WWTP,Bracebridge,ON,45.02,-79.3173,operational,3544,Muskoka,1382.691,1608.343,1274.891,1383.711,1536.77,1258.792,1418.267,thousand m3
24115,District Municipality of Muskoka,Muskoka Beach WWTP,Gravenhurst,ON,44.952,-79.374,operational,3544,Muskoka,1113.3319999999999,1209.26,1031.1399999999999,1153.155,1201.627,1064.504,1072.291,thousand m3
24116,District Municipality of Muskoka,Tower Road WWTP,Bala,ON,45.0086,-79.6187,operational,3544,Muskoka,123.627,136.25400000000002,101.891,105.45400000000001,130.248,116.988,93.952,thousand m3
24117,District Municipality of Muskoka,Medora WWTP,Port Carling,ON,45.1204,-79.5876,operational,3544,Muskoka,180.24,170.797,158.484,178.78300000000002,208.72899999999998,184.623,146.596,thousand m3
24119,District Municipality of Muskoka,Conger WWTP,MacTier,ON,45.1374,-79.785,operational,3544,Muskoka,52.708,60.811,51.74,55.629000000000005,67.366,64.445,64.175,thousand m3
24120,District Municipality of Muskoka,Lone Pine WWTP,Port Severn,ON,44.809,-79.7372,operational,3544,Muskoka,59.969,68.507,63.481,70.83200000000001,85.178,79.68900000000001,76.877,thousand m3
24127,Weenusk First Nation,WFN Lagoon,Peawanuck,ON,55.0182,-85.4172,operational,3560,Kenora,,,,,,,,thousand m3
24128,Six Nations of the Grand River,Six Nations of the Grand River Communal Sewage Treatment System,Ohsweken,ON,43.0692,-80.1095,operational,3529,Brant,0.0,0.0,48.598,0.0,0.0,66.15,84.096,thousand m3
24129,Municipality of Bayham,Port Burwell Wastewater Treatment Plant,Port Burwell,ON,42.6406,-80.8096,operational,3534,Elgin,249.257,230.642,206.303,216.723,233.242,244.522,247.731,thousand m3
24131,Corporation of the Town of Cobalt,Cobalt Wetlands,Cobalt,ON,47.4031,-79.6819,operational,3554,Timiskaming,544.845,1021.116,512.3175,663.442,641.731,370.072,598.746,thousand m3
24132,Corporation of the Municipality of Brockton,Walkerton WWTP,Walkerton,ON,44.1361,-81.16,operational,3541,Bruce,1394.672,1739.202,1239.347,1559.075,1592.2310000000002,1482.064,1351.6109999999999,thousand m3
24187,The Municipality of Lambton Shores,Arkona Sewage Treatment Plant,Lambton Shores,ON,43.0872,-81.828,operational,3538,Lambton,76.69500000000001,64.768,73.43900000000001,81.063,77.024,82.53200000000001,84.586,thousand m3
24189,The Municipality of Lambton Shores,Forest Sewage Treatment Plant,Lambton Shores,ON,43.0902,-82.0166,operational,3538,Lambton,596.127,331.207,440.26,426.811,430.198,419.568,391.41,thousand m3
24191,The Municipality of Lambton Shores,Grand Bend Wastewater Treatment Plant,South Huron,ON,43.2879,-81.75,operational,3540,Huron,293.012,622.363,279.608,182.687,378.064,428.294,388.75,thousand m3
24192,The Municipality of Lambton Shores,Thedford Lagoons,Lambton Shores,ON,43.1715,-81.8631,operational,3538,Lambton,89.22,89.22,89.22,62.454,80.298,110.038,80.298,thousand m3
24193,The Corporation of the Village of Oil Springs,Oil Springs Lagoons,Oil Springs,ON,42.7878,-82.1127,operational,3538,Lambton,88.92,44.160000000000004,46.368,42.036,78.38,42.029,84.057,thousand m3
24201,Corporation of the Town of Rainy River,Rainy River Wastewater Treatment,Rainy River,ON,48.7293,-94.5693,operational,3559,Rainy River,133.068,123.08800000000001,174.305,178.016,190.52,186.163,203.279,thousand m3
24205,Corporation of the Town of Latchford,Latchford Sewage Treatment Plant,Latchford,ON,47.3224,-70.812,operational,,,100.489,104.318,87.635,82.19,86.8579,68.914,88.75800000000001,thousand m3
24237,"Township of MacDonald, Meredith and Aberdeen Additional",Echo Bay Environmental Centre,Echo Bay,ON,46.4882,-84.0743,operational,3557,Algoma,99.001,103.714,87.412,92.584,105.2176,91.5464,97.5463,thousand m3
24238,Town of Blind River,Blind River WPCP,Blind River,ON,46.1839,-82.9541,operational,3557,Algoma,926.5,837.724,676.32,696.7,1054.112,744.274,929.35,thousand m3
24241,Corporation of the Town of Plympton-Wyoming,Lakeshore Area Township of Plympton STP,Camlachie,ON,42.9419,-82.1301,operational,3538,Lambton,442.361,616.92,586.464,541.0160000000001,569.788,590.955,651.665,thousand m3
